{
  "schemaVersion": "ergasterion.generated-output-binding.v1",
  "bindingId": "binding-generated-output-001",
  "applicationId": "ergasterion-output-completion",
  "hostAuthority": {
    "mode": "monas",
    "authorityId": "00000000-0000-0000-0000-00000000000a",
    "projectId": "project-opaque-001",
    "projectRevision": 17
  },
  "prosopikonAuthority": {
    "authorityId": "00000000-0000-0000-0000-000000000028",
    "authorityRevision": 41
  },
  "tenantId": "00000000-0000-0000-0000-000000000014",
  "objectStoreId": "store-synthetic-001",
  "scope": {
    "prefixes": ["projects/project-opaque-001/generated/"],
    "operations": ["write", "complete_upload", "verify"]
  },
  "policyClass": "generated_data",
  "maxObjectBytes": 68719476736,
  "maxTotalBytes": 274877906944,
  "issuedAt": "2026-08-31T09:45:00Z",
  "expiresAt": "2026-08-31T09:50:00Z",
  "status": "active"
}
